{
  "kind": "release-version", "identity": "louke.contract.v0.14-002.release-version", "revision": "prism-round-3-remediation-candidate",
  "schema_ref": {"identity": "louke.machine-contract.release-version", "version": "1.0.0", "digest": "sha256:29a179dff9ad7bc5f6929455310371f9e8eeee1443a20be91367aeab2abfd273"},
  "manifest_ref": {"identity": "louke.design-artifacts.v0.14-002.prism-r3-remediation", "revision": "prism-round-3-remediation-candidate"},
  "scope": {"workspace_id": "github.com/zillionare/louke", "spec_id": "v0.14-002-workflow-reflow-design", "base_commit": "2734177ef5398e4c10a1f68039ec469ccc21f2b8", "project_facts_digest": "sha256:4b1a523c1cf946b480162e5321d3c92aeebdea75f57d5768948aee6f76672130", "project_facts_artifact": {"kind": "host-project-facts-snapshot", "path": "design-artifacts/inputs/host-project-facts.snapshot.json", "identity": "louke.host-project-facts.github.com-zillionare-louke", "revision": "base-2734177-workspace-2026-07-20-r2"}, "release_identity": "0.14.0"}, "generated_by": {"owner": "Runtime/program", "role": "Archer", "task_manifest_digest": "sha256:0a9d58474340e9520af49d2bea462c41533c1fabc81afbcf4f5f292caecefbfc", "task_manifest_artifact": {"kind": "archer-author-task-manifest", "path": "design-artifacts/inputs/archer-author-task-manifest.candidate.json", "identity": "runtime.v0.14-002.m-design.archer.prism-r3-remediation", "revision": "prism-round-3-remediation-candidate"}}, "compatible_runtime": ">=0.14.0,<0.15.0",
  "artifact_refs": [
    {"path": ".louke/project/specs/v0.14-002-workflow-reflow-design/test-plan.md", "digest": "sha256:02a928e09f4abc80ae6ec0c60ec39ba33a131cfd5acc47dc3daeeab97cb4d53e", "ac_ids": ["AC-FR1400-01","AC-NFR0100-01","AC-NFR0300-01"], "interface_ids": ["IF-DES-02","IF-CON-01","IF-REG-01","IF-CI-01","IF-REL-01","IF-PRM-01","IF-REV-01","IF-FCT-01"], "architecture_anchors": ["ARC-FACTS","ARC-REGISTRY","ARC-CONTRACTS","ARC-VALIDATE","ARC-PROMPTS","ARC-CI","ARC-VERSION","ARC-REVIEW","ARC-SECURITY"], "contract_kind": "release-version"},
    {"path": ".louke/project/specs/v0.14-002-workflow-reflow-design/interfaces.md", "digest": "sha256:ce4e83ae0d0f614a43a1912e317859105f84f08ba53fc3e8b1cc150dd108e37f", "ac_ids": ["AC-FR1400-01"], "interface_ids": ["IF-REL-01"], "architecture_anchors": ["ARC-VERSION","ARC-FACTS","ARC-SECURITY"], "contract_kind": "release-version"},
    {"path": ".louke/project/specs/v0.14-002-workflow-reflow-design/architecture.md", "digest": "sha256:32c88eb2062eb0173738086202eddf87122204ee99d32133c1ea30a6c39335cc", "ac_ids": ["AC-FR1400-01","AC-NFR0300-01"], "interface_ids": ["IF-REL-01"], "architecture_anchors": ["ARC-VERSION","ARC-FACTS"], "contract_kind": "release-version"}
  ],
  "payload": {"commands": [{"id":"inspect-source","cwd":".","command":"python tools/louke_python_release_adapter.py inspect-source","implementation_state":"candidate-change-required","success":"JSON source=pyproject.toml selector=project.version version=0.14.0","failure":"missing/invalid selector/version/mapping or output nonzero"},{"id":"prepare-version","cwd":"isolated build workspace","command":"python tools/louke_python_release_adapter.py prepare --tag v0.14.0","implementation_state":"existing","success":"only declared source prepared as 0.14.0 with digest evidence","failure":"invalid tag, mapping/write/source error or user workspace mutation nonzero"}], "canonical_input":"0.14.0","normalization":"strip exact external prefix v; parse PEP 440; canonical must equal 0.14.0","branch_mapping":"releases/0.14.0","tag_mapping":"v0.14.0","version_source":{"path":"pyproject.toml","selector":"project.version"},"adapter":"tools/louke_python_release_adapter.py","read_command":"python tools/louke_python_release_adapter.py inspect-source","prepare_command":"python tools/louke_python_release_adapter.py prepare --tag v0.14.0","write_policy":"PR validates only; release writes only isolated build workspace version source","compare":"exact normalized PEP 440 equality across source, artifacts and installed outlets","evidence":["version-scheme-selected","version-source-prepared"], "failure_policy": {"fail_closed": true, "non_success": ["missing","invalid","mismatch","write-error","unknown","drift"], "current_state": "candidate-not-installed"}}
}
